<?xml version="1.0" encoding="UTF-8"?>

<CSCertificates xsi:noNamespaceSchemaLocation="./cscertificate_schema.xsd" xmlns:xsi="http://www.w3.org/2001/XMLSchema-instance">
    <AICERTReq>
        <CertCore>
            <course>
                <subject>CMP SCI</subject>
                <course_number>3130</course_number>
                <course_name>Design and Analysis of Algorithms</course_name>
                <credit>3</credit>
                <rotation_term>
                    <term>Spring</term>
                    <time_code>D, E, O</time_code>
                </rotation_term>
                <rotation_term>
                    <term>Fall</term>
                    <time_code>D, E, O</time_code>
                </rotation_term>
                <rotation_term>
                    <term>Summer</term>
                    <time_code>O, H</time_code>
                </rotation_term>
                <course_description>Addresses the design and analysis of fundamental algorithms in computer science. Studies basic sorting algorithms priority queues, order statistics, search trees, and hash tables. Analysis techniques may involve time and space complexity analysis of both iterative and recursive algorithms, analysis of algorithm correctness, and amortized complexity analysis. Additional topics may include data compression, string manipulation, greedy algorithms, dynamic programming, and graph traversal.</course_description>
                <prerequisite>
                    <or_choice>
                        <and_required>CMP SCI 2250</and_required>
                        <and_required>MATH 1320</and_required>
                        <and_required>MATH 3000</and_required>
                    </or_choice>
                </prerequisite>
                <prerequisite_description>Prerequisites: CMP SCI 2250, MATH 1320, and MATH 3000. </prerequisite_description>
                <required>true</required>
            </course>
            <course>
                <subject>CMP SCI</subject>
                <course_number>4300</course_number>
                <course_name>Introduction to Artificial Intelligence</course_name>
                <credit>3</credit>
                <rotation_term>
                    <term>Spring</term>
                    <time_code>H</time_code>
                </rotation_term>
                <rotation_term>
                    <term>Fall</term>
                    <time_code>H</time_code>
                </rotation_term>
                <course_description>This course provides an introduction to artificial intelligence. The list of topics may include search, planning, knowledge-based reasoning, probabilistic inference, machine learning, natural language processing, and practical applications. Credit cannot be granted for both CMP SCI 4300 and CMP SCI 5300.</course_description>
                <prerequisite>
                    <or_choice>
                        <and_required>CMP SCI 3130</and_required>
                    </or_choice>
                </prerequisite>
                <prerequisite_description>The list of topics may include search, planning, knowledge-based reasoning, probabilistic inference, machine learning, natural language processing, and practical applications. Credit cannot be granted for both CMP SCI 4300 and CMP SCI 5300.</prerequisite_description>
                <paired>CMP SCI 5300</paired>
                <required>true</required>
            </course>
        </CertCore>
        <CertElectives>
            <course>
                <subject>CMP SCI</subject>
                <course_number>4151</course_number>
                <course_name>Introduction to Statistical Methods for Data Science</course_name>
                <credit>3</credit>
                <rotation_term>
                    <term>Fall</term>
                    <time_code>H</time_code>
                </rotation_term>
                <course_description>This course covers statistical inference with emphasis on applications and computer simulation. Topics may include multivariate distributions, transformations and combinations of random variables, sampling distributions, maximum likelihood, bootstrap, order statistics, hypothesis testing, likelihood ratio tests, Monte Carlo methods, Bayesian inference, and sufficient statistics. </course_description>
                <prerequisite>
                    <or_choice>
                        <and_required>CMP SCI 1250</and_required>
                        <and_required>MATH 1900</and_required>
                        <and_required>MATH 1320</and_required>
                    </or_choice>
                </prerequisite>
                <prerequisite_description>Prerequisites: CMP SCI 1250, MATH 1900, and an introductory statistics course (ANTHRO 3220/SOC 3220, BIOL 4122, CRIMIN 2220, ECON 3100, MATH 1320, POL SCI 3000, or PSYCH 2201). </prerequisite_description>
            </course>
            <course>
                <subject>CMP SCI</subject>
                <course_number>4320</course_number>
                <course_name>Introduction to Evolutionary Computation</course_name>
                <credit>3</credit>
                <rotation_term>
                    <term>Spring</term>
                    <time_code>H</time_code>
                </rotation_term>
                <course_description>This course introduces the concepts of nature-inspired problem solving with artificial evolution using selection, crossover, mutation and inheritance. It discusses applications of evolutionary algorithms, overviews the existing models and instances, and analyzes specific instances such as genetic algorithms, evolutionary programming, evolution strategies, and genetic programming. </course_description>
                <prerequisite>
                    <or_choice>
                        <and_required>CMP SCI 2261</and_required>
                        <and_required>CMP SCI 2750</and_required>
                        <and_required>CMP SCI 3130</and_required>
                    </or_choice>
                </prerequisite>
                <prerequisite_description>Prerequisites: CMP SCI 2261, CMP SCI 2750 and CMP SCI 3130. </prerequisite_description>
            </course>
            <course>
                <subject>CMP SCI</subject>
                <course_number>4340</course_number>
                <course_name>Introduction to Machine Learning</course_name>
                <credit>3</credit>
                <rotation_term>
                    <term>Spring</term>
                    <time_code>H</time_code>
                </rotation_term>
                <rotation_term>
                    <term>Fall</term>
                    <time_code>H</time_code>
                </rotation_term>
                <course_description>Provides an introduction to machine learning in the context of applications such as data mining, natural language processing, and adaptive computer systems. The course reviews several supervised, unsupervised, and reinforcement machine learning techniques such as naive Bayes networks, clustering, and decision trees. Selected concepts in computational learning theory may also be covered. Credit cannot be granted for both CMP SCI 4340 and CMP SCI 5340.</course_description>
                <prerequisite>
                    <or_choice>
                        <and_required>CMP SCI 4342</and_required>
                    </or_choice>
                    <or_choice>
                        <and_required>CMP SCI 2261</and_required>
                        <and_required>CMP SCI 3130</and_required>
                    </or_choice>
                </prerequisite>
                <paired>CMP SCI 5340</paired>
                <prerequisite_description>Prerequisites: CMP SCI 4342, or CMP SCI 2261 and CMP SCI 3130, or consent of instructor.</prerequisite_description>
            </course>
            <course>
                <subject>CMP SCI</subject>
                <course_number>4342</course_number>
                <course_name>Introduction to Data Mining</course_name>
                <credit>3</credit>
                <rotation_term>
                    <term>Spring</term>
                    <time_code>H</time_code>
                </rotation_term>
                <rotation_term>
                    <term>Fall</term>
                    <time_code>H</time_code>
                </rotation_term>
                <course_description>This course provides an introduction to data mining principles, algorithms and applications. Topics may include data preprocessing, data transformation, similarity and dissimilarity measures, data representation, classification techniques, association analysis, cluster analysis, regression, dimension reduction, and anomaly detection. Credit not granted for both CMP SCI 4342 and CMP SCI 5342.</course_description>
                <prerequisite>
                    <or_choice>
                        <and_required>CMP SCI 2261</and_required>
                        <and_required>CMP SCI 3130</and_required>
                    </or_choice>
                    <or_choice>
                        <and_required>CMP SCI 4200</and_required>
                    </or_choice>
                </prerequisite>
                <paired>CMP SCI 5342</paired>
                <prerequisite_description>Prerequisites: CMP SCI 2261 and CMP SCI 3130, or CMP SCI 4200, or consent of the instructor. </prerequisite_description>
            </course>
            <course>
                <subject>CMP SCI</subject>
                <course_number>4370</course_number>
                <course_name>Introduction to Biological Data Science</course_name>
                <credit>3</credit>
                <rotation_term>
                    <term>Fall</term>
                    <time_code>E</time_code>
                </rotation_term>